{
  "id": "handoff-hello-world-readme-title",
  "task_brief_id": "task-hello-world-readme-title",
  "origin": {
    "actor": "codex",
    "thread": "base-tecnica-aletheia-hello-world",
    "date": "2026-04-01T19:34:00Z"
  },
  "status": "done",
  "completed": [
    "Task was framed with a low-risk brief",
    "Minimal context pack was assembled",
    "Decision was recorded before execution",
    "Mock execution and validation were documented"
  ],
  "pending": [
    "Reuse the same structure for the next hello-world variants"
  ],
  "risks": [
    "If future examples become too domain-specific, the framework may lose agnosticism"
  ],
  "reopen_context": {
    "summary": "This hello-world proves the smallest end-to-end AletheIA loop for a documentation-only task.",
    "required_files": [
      "docs/examples/aletheia/hello-world/README.md",
      "docs/architecture/aletheia-core-contracts.md"
    ],
    "next_action": "Create the next example with low confidence requiring review"
  },
  "validation_next": [
    "Check whether the example remains understandable to non-developers",
    "Reuse the same contract chain in the next scenario"
  ]
}
